Detected,Issue,Related to Tensor,Buggy API,Time,Version,CUDA,Category,Impact,Log Rule,Log Message,Category.1,Trigger Mechanism,Within Scope,Need More Inspection,Reason not agree,Unnamed: 16
,https://github.com/pytorch/pytorch/commit/1a845579b67f522e22d899126c92672f46f6a7b9,yes,torch.rand,2022,2.1.0,,Logical,Inconsistent results,object is not subscriptable,"/home/xxx/.local/lib/python3.7/site-packages/torch/onnx/utils.py:366: UserWarning: Skipping _decide_input_format
 'NoneType' object is not subscriptable
  warnings.warn(""Skipping _decide_input_format\n {}"".format(e.args[0]))
PyTorch Output DTypes: (torch.float64, torch.float32)
ONNX Output DTypes: ('onnx.TensorProto.FLOAT', 'onnx.TensorProto.FLOAT')",API Input Context,Modeling Specific Inputs,,,,
,https://github.com/pytorch/pytorch/commit/75db05c3fdb6f3b6682dab1532cd6e1e5b423527,yes,torch.set_default_dtype,2022,2.0.0,,Vulnerability,Segmentation fault,Segmentation fault,segmentation fault,API Input Context,Supporting Specific Data Types,,,,
,https://github.com/pytorch/pytorch/commit/b69155f754bb077acf0dc3e32251f0352234ed5c,yes,torch.save,2021,2.0.0,,Logical,RuntimeError,Trying to resize storage that is not resizable,RuntimeError: Trying to resize storage that is not resizable at ../aten/src/TH/THStorageFunctions.cpp:100,Test Case Context,Modeling Multiple API Usage Pattern,,,,
,https://github.com/pytorch/pytorch/commit/6c235ef267c350225b7ca3f0caedb1a05c9df9ec,yes,torch.normal,2021,2.0.0,,Logical,RuntimeError,but found std,"RuntimeError: normal_ expects std > 0.0, but found std=-1",API Input Context,Negative Integer Argument,,,,
